<?xml version='1.0' encoding='utf-8'?>
<cms:CuemsProjectMappings xmlns:cms="https://stagelab.coop/cuems/"
    xmlns:xsi="http://www.w3.org/2001/XMLSchema-instance"
    xsi:schemaLocation="https://stagelab.coop/cuems/ project_mappings.xsd">
    <number_of_nodes>1</number_of_nodes>
    <default_audio_input>0367f391-ebf4-48b2-9f26-000000000001_system:capture_1</default_audio_input>
    <default_audio_output>0367f391-ebf4-48b2-9f26-000000000001_system:playback_1</default_audio_output>
    <default_video_input />
    <default_video_output>0367f391-ebf4-48b2-9f26-000000000001_0</default_video_output>
    <default_dmx_input />
    <default_dmx_output>0367f391-ebf4-48b2-9f26-000000000001</default_dmx_output>
    <nodes>
        <node>
            <uuid>0367f391-ebf4-48b2-9f26-000000000001</uuid>
            <mac>2cf05d21cca3</mac>
            <audio>
                <outputs>
                    <output>
                        <id>0</id>
                        <name>system:playback_1</name>
                        <mappings>
                            <mapped_to>system:playback_1</mapped_to>
                        </mappings>
                    </output>
                    <output>
                        <id>1</id>
                        <name>system:playback_2</name>
                        <mappings>
                            <mapped_to>system:playback_2</mapped_to>
                        </mappings>
                    </output>
                </outputs>
                <inputs>
                    <input>
                        <id>0</id>
                        <name>system:capture_1</name>
                        <mappings>
                            <mapped_to>system:capture_1</mapped_to>
                        </mappings>
                    </input>
                    <input>
                        <id>1</id>
                        <name>system:capture_2</name>
                        <mappings>
                            <mapped_to>system:capture_2</mapped_to>
                        </mappings>
                    </input>
                </inputs>
            </audio>
            <video>
                <outputs>
                    <output>
                        <id>0</id>
                        <name>0</name>
                        <mappings>
                            <mapped_to>salida_001</mapped_to>
                        </mappings>
                    </output>
                    <output>
                        <id>1</id>
                        <name>1</name>
                        <mappings>
                            <mapped_to>salida_002</mapped_to>
                        </mappings>
                    </output>
                    <output>
                        <id>2</id>
                        <name>custom</name>
                        <canvas_region>
                            <x>0.0</x>
                            <y>0.0</y>
                            <width>1.0</width>
                            <height>1.0</height>
                        </canvas_region>
                        <mappings>
                            <mapped_to>custom</mapped_to>
                        </mappings>
                    </output>
                </outputs>
            </video>
            <dmx>
                <outputs>
                    <output>
                        <id>0</id>
                        <name>0</name>
                        <mappings>
                            <mapped_to>salida_dmx_1</mapped_to>
                        </mappings>
                    </output>
                </outputs>
            </dmx>
        </node>
    </nodes>
    <new_nodes>
        <node>
            <uuid>0367f391-ebf4-48b2-9f26-000000000002</uuid>
            <mac>2cf05d21cca4</mac>
            <audio>
                <outputs>
                    <output>
                        <id>0</id>
                        <name>system:playback_1</name>
                        <mappings>
                            <mapped_to>system:playback_1</mapped_to>
                        </mappings>
                    </output>
                    <output>
                        <id>1</id>
                        <name>system:playback_2</name>
                        <mappings>
                            <mapped_to>system:playback_2</mapped_to>
                        </mappings>
                    </output>
                </outputs>
                <inputs>
                    <input>
                        <id>0</id>
                        <name>system:capture_1</name>
                        <mappings>
                            <mapped_to>system:capture_1</mapped_to>
                        </mappings>
                    </input>
                    <input>
                        <id>1</id>
                        <name>system:capture_2</name>
                        <mappings>
                            <mapped_to>system:capture_2</mapped_to>
                        </mappings>
                    </input>
                </inputs>
            </audio>
            <video>
                <outputs>
                    <output>
                        <id>0</id>
                        <name>0</name>
                        <mappings>
                            <mapped_to>salida_001</mapped_to>
                        </mappings>
                    </output>
                    <output>
                        <id>1</id>
                        <name>1</name>
                        <mappings>
                            <mapped_to>salida_002</mapped_to>
                        </mappings>
                    </output>
                    <output>
                        <id>2</id>
                        <name>custom</name>
                        <canvas_region>
                            <x>0.0</x>
                            <y>0.0</y>
                            <width>1.0</width>
                            <height>1.0</height>
                        </canvas_region>
                        <mappings>
                            <mapped_to>custom</mapped_to>
                        </mappings>
                    </output>
                </outputs>
            </video>
            <dmx>
                <outputs>
                    <output>
                        <id>0</id>
                        <name>0</name>
                        <mappings>
                            <mapped_to>salida_dmx_1</mapped_to>
                        </mappings>
                    </output>
                </outputs>
            </dmx>
        </node>
        <node>
            <uuid>0367f391-ebf4-48b2-9f26-000000000003</uuid>
            <mac>2cf05d21cca5</mac>
        </node>
    </new_nodes>
</cms:CuemsProjectMappings>
