<?xml version='1.0' encoding='utf-8'?>
<cms:CuemsProjectMappings xmlns:cms="https://stagelab.coop/cuems/" xmlns:xsi="http://www.w3.org/2001/XMLSchema-instance" xsi:schemaLocation="https://stagelab.coop/cuems/ /etc/cuems/project_mappings.xsd">
    <number_of_nodes>1</number_of_nodes>
    <defaults>
        <default class="audio" direction="input">0367f391-ebf4-48b2-9f26-000000000001_system:capture_1</default>
        <default class="audio" direction="output">0367f391-ebf4-48b2-9f26-000000000001_system:playback_1</default>
        <default class="video" direction="input" />
        <default class="video" direction="output">0367f391-ebf4-48b2-9f26-000000000001_0</default>
        <default class="dmx" direction="input" />
        <default class="dmx" direction="output" />
    </defaults>
    <nodes>
        <node>
            <uuid>0367f391-ebf4-48b2-9f26-000000000001</uuid>
            <mac>2cf05d21cca3</mac>
            <devices>
                <device class="audio">
                    <outputs>
                        <output>
                            <id>0</id>
                            <name>system:playback_1</name>
                            <mappings>
                                <mapped_to>system:playback_1</mapped_to>
                            </mappings>
                        </output>
                        <output>
                            <id>1</id>
                            <name>system:playback_2</name>
                            <mappings>
                                <mapped_to>system:playback_2</mapped_to>
                            </mappings>
                        </output>
                    </outputs>
                    <inputs>
                        <input>
                            <id>0</id>
                            <name>system:capture_1</name>
                            <mappings>
                                <mapped_to>system:capture_1</mapped_to>
                            </mappings>
                        </input>
                        <input>
                            <id>1</id>
                            <name>system:capture_2</name>
                            <mappings>
                                <mapped_to>system:capture_2</mapped_to>
                            </mappings>
                        </input>
                    </inputs>
                </device>
                <device class="video">
                    <outputs>
                        <output>
                            <id>0</id>
                            <name>0</name>
                            <mappings>
                                <mapped_to>salida_001</mapped_to>
                            </mappings>
                        </output>
                        <output>
                            <id>1</id>
                            <name>1</name>
                            <canvas_region>
                                <x>0</x>
                                <y>0</y>
                                <width>1</width>
                                <height>1</height>
                            </canvas_region>
                            <mappings>
                                <mapped_to>salida_002</mapped_to>
                            </mappings>
                        </output>
                    </outputs>
                </device>
                <device class="dmx" />
            </devices>
        </node>
        <node>
            <uuid>0367f391-ebf4-48b2-9f26-000000000002</uuid>
            <mac>2cf05d21cca3</mac>
            <devices>
                <device class="audio">
                    <outputs>
                        <output>
                            <id>0</id>
                            <name>system:playback_1</name>
                            <mappings>
                                <mapped_to>system:playback_1</mapped_to>
                            </mappings>
                        </output>
                        <output>
                            <id>1</id>
                            <name>system:playback_2</name>
                            <mappings>
                                <mapped_to>system:playback_2</mapped_to>
                            </mappings>
                        </output>
                    </outputs>
                    <inputs>
                        <input>
                            <id>0</id>
                            <name>system:capture_1</name>
                            <mappings>
                                <mapped_to>system:capture_1</mapped_to>
                            </mappings>
                        </input>
                        <input>
                            <id>1</id>
                            <name>system:capture_2</name>
                            <mappings>
                                <mapped_to>system:capture_2</mapped_to>
                            </mappings>
                        </input>
                    </inputs>
                </device>
                <device class="video">
                    <outputs>
                        <output>
                            <id>0</id>
                            <name>0</name>
                            <mappings>
                                <mapped_to>salida_001</mapped_to>
                            </mappings>
                        </output>
                        <output>
                            <id>1</id>
                            <name>1</name>
                            <canvas_region>
                                <x>0</x>
                                <y>0</y>
                                <width>1</width>
                                <height>1</height>
                            </canvas_region>
                            <mappings>
                                <mapped_to>salida_002</mapped_to>
                            </mappings>
                        </output>
                    </outputs>
                </device>
                <device class="dmx" />
            </devices>
        </node>
    </nodes>
    <new_nodes />
</cms:CuemsProjectMappings>