<?xml version='1.0' encoding='utf-8'?>
<cms:CuemsProjectMappings xmlns:cms="https://stagelab.coop/cuems/" xmlns:xsi="http://www.w3.org/2001/XMLSchema-instance" xsi:schemaLocation="https://stagelab.coop/cuems/ project_mappings.xsd">
    <number_of_nodes>2</number_of_nodes>
    <defaults>
        <default class="audio" direction="input">2cf05d21cca3 system:capture_1</default>
        <default class="audio" direction="output">2cf05d21cca3 system:playback_1</default>
        <default class="video" direction="input" />
        <default class="video" direction="output">2cf05d21cca3 0</default>
        <default class="dmx" direction="input" />
        <default class="dmx" direction="output" />
    </defaults>
    <nodes>
        <node>
            <uuid>0367f391-ebf4-48b2-9f26-000000000001</uuid>
            <mac>2cf05d21cca3</mac>
            <devices>
                <device class="audio">
                    <outputs>
                        <output>
                            <id>0</id>
                            <name>system:playback_1</name>
                            <mappings>
                                <mapped_to>system:playback_1</mapped_to>
                                <mapped_to>Out1</mapped_to>
                            </mappings>
                        </output>
                        <output>
                            <id>1</id>
                            <name>system:playback_2</name>
                            <mappings>
                                <mapped_to>system:playback_2</mapped_to>
                            </mappings>
                        </output>
                    </outputs>
                    <inputs>
                        <input>
                            <id>0</id>
                            <name>system:capture_1</name>
                            <mappings>
                                <mapped_to>system:capture_1</mapped_to>
                            </mappings>
                        </input>
                        <input>
                            <id>1</id>
                            <name>system:capture_2</name>
                            <mappings>
                                <mapped_to>system:capture_2</mapped_to>
                            </mappings>
                        </input>
                    </inputs>
                </device>
                <device class="video">
                    <outputs>
                        <output>
                            <id>0</id>
                            <name>0</name>
                            <mappings>
                                <mapped_to>0</mapped_to>
                                <mapped_to>VideoOut1</mapped_to>
                                <mapped_to>VideoOut2</mapped_to>
                                <mapped_to>VideoOut3</mapped_to>
                                <mapped_to>VideoOut4</mapped_to>
                            </mappings>
                        </output>
                        <output>
                            <id>1</id>
                            <name>custom</name>
                            <canvas_region>
                                <x>0.0</x>
                                <y>0.0</y>
                                <width>1.0</width>
                                <height>1.0</height>
                            </canvas_region>
                            <mappings>
                                <mapped_to>custom</mapped_to>
                            </mappings>
                        </output>
                    </outputs>
                </device>
                <device class="dmx" />
            </devices>
        </node>
        <node>
            <uuid>0367f391-ebf4-48b2-9f26-000000000003</uuid>
            <mac>0800276db133</mac>
            <devices>
                <device class="audio">
                    <outputs>
                        <output>
                            <id>0</id>
                            <name>system:playback_1</name>
                            <mappings>
                                <mapped_to>system:playback_1</mapped_to>
                            </mappings>
                        </output>
                        <output>
                            <id>1</id>
                            <name>system:playback_2</name>
                            <mappings>
                                <mapped_to>system:playback_2</mapped_to>
                            </mappings>
                        </output>
                    </outputs>
                </device>
                <device class="video">
                    <outputs>
                        <output>
                            <id>0</id>
                            <name>0</name>
                            <mappings>
                                <mapped_to>0</mapped_to>
                            </mappings>
                        </output>
                        <output>
                            <id>1</id>
                            <name>custom</name>
                            <canvas_region>
                                <x>0.0</x>
                                <y>0.0</y>
                                <width>1.0</width>
                                <height>1.0</height>
                            </canvas_region>
                            <mappings>
                                <mapped_to>custom</mapped_to>
                            </mappings>
                        </output>
                    </outputs>
                </device>
                <device class="dmx" />
            </devices>
        </node>
    </nodes>
    <new_nodes />
</cms:CuemsProjectMappings>